DATE,TITLE,MAIN_NEWS,SOURCE_URL,tokens
14/05/2020,सगरमाथाबारे भ्रम फैलाएको भन्दै महोत्तरीमा चिनियाँ राष्ट्रपतिको पुत्ला दहन," महोतरी-महोत्तरीको बर्दिवासमा स्थानीय युवाहरुले चिनियाँ राष्ट्रपति सी चीनफिङको पुत्ला दहन गरेका छन् । नेपाल प्रहरीमाथि चिनीयाँ नागरिकहरुले गरेको आक्रमण र चिनियाँ मिडियाले सर्वोच्च शिखर सगरमाथा आफ्नो भूमिमा रहेको भन्दै ट्वीट गरेको विषयलाई लिएर लालबन्दीमा युवाहरुले चिनियाँ राष्ट्रपति सी चीनफिङको पुत्ला दहन गरेका हुन् । बर्दीवासमा गौतम पाण्डको नेतृत्वमा युवाहरुको समूहले चिनीयाँ राष्ट्रपति जिनपिङको पुतला दहन गरेका हुन् । केही दिन अघिचीनको राष्ट्रिय टेलिभिजन चाइना ग्लोबल टेलिभिजन नेटवर्कले आधिकारिक ट्वीटर पेजमा चोमोलोङमाको चुचुरो माथि देखिएको विशेष किसिमको सूर्यको दृश्य भनी तस्बिर राखेको थियो । जसमा विश्वको सर्वोच्च शिखर माउन्ट एभरेष्ट चीनमा पर्छ भनिएको छ । त्यस्तै, चिनीयाँ नागरिकहरु नेपालमै वसी नेपाल प्रहरीमाथि आक्रमण गर्नु गम्भीर विषय बनेको भन्दै युवाहरु आक्रोस पोखेका छन् । केहिदिन अघिमात्र राजधानी काठमाडौंका विभिन्न क्षेत्रमा बस्ने चिनियाँहरू सिंहदरबार अगाडि भेला भएर नेपाल प्रहरीमाथि आक्रमण गरेका थिए ।  स्वदेश फर्किन पाउनुपर्ने मागसहित सिंहदरबार अगाडि प्रदर्शनमा उत्रेका चिनियाँलाई हटाउन खोज्दा प्रहरीमाथि नै आक्रामक बनेका थिए । सोही विषयमा युवाहरु आक्रोस पोखेका हुन् । यसअघि, सिन्धुलीको भिमानमा डा. केशव पौडेलको नेतृत्वमा केही युवाहरुले सोही विषयमा चिनियाँ राष्ट्रपति सी चीनफिङको पुत्ला दहन गरेका थिए । यसैबीच सर्लाहीका युवाहरुले पनि सोही विषयलाई लिएर चीन विरोधी नारा लगाउँदै चिनयाँ राष्ट्रपतिको पुत्ला दहन गरेका छन् ।",https://www.khabarhub.com/2020/13/164226/,"महोतरी,महोत्तरीको,बर्दिवास,स्थानीय,युवा,चिनियाँ,राष्ट्रपति,सी,चीनफिङ,पुत्ला,दहन,प्रहरी,चिनीयाँ,नागरिक,आक्रमण,चिनियाँ,मिडिया,सर्वोच्च,शिखर,सगरमाथा,भूमि,रहे,ट्वीट,विषय,लिएर,लालबन्दी,युवा,चिनियाँ,राष्ट्रपति,सी,चीनफिङ,पुत्ला,दहन,बर्दीवास,गौतम,पाण्ड,नेतृत्व,युवा,समूह,चिनीयाँ,राष्ट्रपति,जिनपिङ,पुतला,दहन,अघिचीन,राष्ट्रिय,टेलिभिजन,चाइना,ग्लोबल,टेलिभिजन,नेटवर्क,आधिकारिक,ट्वीटर,पेज,चोमोलोङमा,चुचुरो,देखिए,विशेष,किसिम,सूर्य,दृश्य,भनी,तस्बिर,जस,विश्व,सर्वोच्च,शिखर,माउन्ट,एभरेष्ट,चीन,भनिए,चिनीयाँ,नागरिक,वसी,प्रहरी,आक्रमण,गम्भीर,विषय,युवा,आक्रोस,पोखे,केहिदिन,राजधानी,काठमाडौं,विभिन्न,क्षेत्र,बस्ने,चिनियाँ,सिंहदरबार,भेला,प्रहरी,आक्रमण,स्वदेश,फर्किन,पाउनु,माग,सिंहदरबार,प्रदर्शन,उत्रे,चिनियाँ,हटाउन,खोज्दा,प्रहरी,आक्रामक,विषय,युवा,आक्रोस,पोखे,भिमान,डा,केशव,पौडेल,नेतृत्व,युवा,विषय,चिनियाँ,राष्ट्रपति,सी,चीनफिङ,पुत्ला,दहन,यसै,युवा,विषय,लिएर,चीन,विरोधी,नारा,लगाउँदै,चिनयाँ,राष्ट्रपति,पुत्ला,दहन"
13/05/2020,सगरमाथाबारे भ्रम फैलाएको भन्दै बाराका युवाहरुद्वारा चीनविरुद्ध प्रदर्शन, काठमाडौं- सर्वोच्च शिखर सगरमाथाबारे चिनियाँ मिडियाले भ्रम छरेको भन्दै बाराका युवाहरुले चीनविरुद्ध प्रदर्शन गरेका छन् । बाराका स्थानीय युवाहरु मंगलबार राष्ट्रिय झण्डासहित प्रदर्शनमा उत्रिएका हुन । उनीहरुले चीन विरोधी नारा लगाउँदै चिनियाँ राष्ट्रपतिको पुत्दा समेत दहन गरे । ‘गो ब्याक चाइना’ लेखिएका प्ले कार्डसहित उनीहरु चीनविरूद्ध प्रदर्शन गरेका हुन् ।  २ मे मा चीनको राष्ट्रिय टेलिभिजन चाइना ग्लोबल टेलिभिजन नेटवर्कले आधिकारिक ट्वीटरमा चोमोलोङमाको चुचुरोमाथि देखिएको विशेष किसिमको सूर्यको दृश्य भनी तस्बिर राखेको थियो । जसमा विश्वको सर्वोच्च शिखर माउन्ट एभरेष्ट चीनमा पर्छ भनिएको थियो । सो विषयलाई लिएर उनीहरुले विरोध जनाएका हुन् । यही विषयमा नेपालीहरुले सामाजिक सञ्चालमा चीनको विरोध जनाइरहेका छन् । गलत सूचना सम्प्रेषण गरेको भन्दै सामाजिक सञ्जालमा विरोध भएको हो । उनीहरुले ऐतिहासिक तथ्य हेर्न र सच्याउन सुझाव दिएका छन् ।,https://www.khabarhub.com/2020/12/163824/,"काठमाडौं,सर्वोच्च,शिखर,सगरमाथा,चिनियाँ,मिडिया,भ्रम,छरे,युवा,चीन,प्रदर्शन,स्थानीय,युवा,मंगलबार,राष्ट्रिय,झण्डा,प्रदर्शन,उत्रिए,चीन,विरोधी,नारा,लगाउँदै,चिनियाँ,राष्ट्रपति,पुत्दा,दहन,गो,ब्याक,चाइना,लेखिए,प्,कार्ड,चीनविरूद्ध,प्रदर्शन,मे,चीन,राष्ट्रिय,टेलिभिजन,चाइना,ग्लोबल,टेलिभिजन,नेटवर्क,आधिकारिक,ट्वीटर,चोमोलोङमा,चुचुरो,देखिए,विशेष,किसिम,सूर्य,दृश्य,भनी,तस्बिर,जस,विश्व,सर्वोच्च,शिखर,माउन्ट,एभरेष्ट,चीन,भनिए,विषय,लिएर,विरोध,जनाए,विषय,नेपाली,सामाजिक,सञ्चाल,चीन,विरोध,जनाइ,गलत,सूचना,सम्प्रेषण,सामाजिक,सञ्जाल,विरोध,ऐतिहासिक,तथ्य,हेर्न,सच्याउन,सुझाव"
12/05/2020,सगरमाथाबारे भ्रम फैलाएको भन्दै गोरखामा चिनियाँ राष्ट्रपतिको पुत्ला दहन, काठमाडौं- सगरमाथाबारे चिनियाँ मिडियाले भ्रम फैलाएको भन्दै नेपाली कांग्रेसको भ्रातृ संगठन नेविसंघ र तरुणदलले गोरखामा चिनियाँ राष्ट्रपतिको पुत्ला दहन गरेका छन् । उनीहरुले चिन विरोधी नारा लगाउँदै राँके जुलुस समेत निकालेका हुन। नेविसंघ गोरखा नगरपालिका र तरुण दलद्वारा आयोजित राके जुलुस एवम् पुत्ला दहन कार्यक्रमा उनीहरुले सरकारको समेत विरोध गरेका थिए । उनीहरुले नेपालमा विदेशी हस्तक्षेप हुँदा समेत सरकारले कुटनीतिक पहल नगरेको आरोप लगाएका छन् । नेबिसंघ गोरखा नगर सभापति सुमन पन्तको संयोजनमा भएको कार्यक्रममा चिनियाँ राष्ट्रपति सी चीनफिङको पुत्ला दहन गरिएको थियो ।उनीहरुले ‘गो ब्याक चाइना’ भारतीय हस्तक्षेप बन्द गर लगायतका नागर लगाएका थिए । केही दिन अघि चिनियाँ एक मिडियाले आधिकारिक ट्वीटरबाट सगरमाथा क्षेत्रका केही तस्वीरहरु समेत राखेर सगरमाथा चीनमा पर्ने उल्लेख गरेको थियो । यही विषयमा नेपालीहरुले सामाजिक सञ्जालमा समेत चीनको विरोध जनाएका छन् ।  नेबिसंघ गोरखा नगर सभापति सुमन पन्तको संयोजनमा भएको कार्यक्रममा चिनियाँ राष्ट्रपति सी चीनफिङको पुत्ला दहन गरिएको थियो ।उनीहरुले ‘गो ब्याक चाइना’ भारतीय हस्तक्षेप बन्द गर लगायतका नागर लगाएका थिए । केही दिन अघि चिनियाँ एक मिडियाले आधिकारिक ट्वीटरबाट सगरमाथा क्षेत्रका केही तस्वीरहरु समेत राखेर सगरमाथा चीनमा पर्ने उल्लेख गरेको थियो । यही विषयमा नेपालीहरुले सामाजिक सञ्जालमा समेत चीनको विरोध जनाएका छन् ।,https://www.khabarhub.com/2020/12/163851/,"काठमाडौं,सगरमाथा,चिनियाँ,मिडिया,भ्रम,फैलाए,नेपाली,कांग्रेस,भ्रातृ,संगठन,नेविसंघ,तरुणदल,चिनियाँ,राष्ट्रपति,पुत्ला,दहन,चिन,विरोधी,नारा,लगाउँदै,राँके,जुलुस,निकाले,नेविसंघ,नगरपालि,तरुण,दल,आयोजित,राके,जुलुस,एवम्,पुत्ला,दहन,कार्यक्र,सरकार,विरोध,विदेशी,हस्तक्षेप,हुँदा,सरकार,कुटनीतिक,पहल,नगरे,आरोप,लगाए,नेबिसंघ,नगर,सभापति,सुमन,पन्त,संयोजन,कार्यक्रम,चिनियाँ,राष्ट्रपति,सी,चीनफिङ,पुत्ला,दहन,गरिए,गो,ब्याक,चाइना,भारतीय,हस्तक्षेप,बन्द,गर,नागर,लगाए,चिनियाँ,मिडिया,आधिकारिक,ट्वीटर,सगरमाथा,क्षेत्र,तस्वीर,राखेर,सगरमाथा,चीन,उल्लेख,विषय,नेपाली,सामाजिक,सञ्जाल,चीन,विरोध,जनाए,नेबिसंघ,नगर,सभापति,सुमन,पन्त,संयोजन,कार्यक्रम,चिनियाँ,राष्ट्रपति,सी,चीनफिङ,पुत्ला,दहन,गरिए,गो,ब्याक,चाइना,भारतीय,हस्तक्षेप,बन्द,गर,नागर,लगाए,चिनियाँ,मिडिया,आधिकारिक,ट्वीटर,सगरमाथा,क्षेत्र,तस्वीर,राखेर,सगरमाथा,चीन,उल्लेख,विषय,नेपाली,सामाजिक,सञ्जाल,चीन,विरोध,जनाए"
11/05/2020,दूतावास अगाडि प्रदर्शन गर्न पुगेका राप्रपाका कार्यकर्ता पक्राउ," काठमाडौं- नेपाली भूमि लिपुलेक हुँदै भारतले सडक निर्माण गरीसीमा अतिक्रमण गरेको भन्दै राप्रपाको भातृ संगठन युवा, विद्यार्थी र महिला संगठनले आज राजधानीमा विरोध प्रदर्शन गरेको छ । भारतीय राजदूतावास अगाडि जाने क्रममा ती संगठनले गरेको प्रदर्शनमा प्रहरीले हस्तक्षप गरेको छ । राष्ट्रिय प्रजातान्त्रिक युवा संगठनका अध्यक्ष प्रकाश रिमाल, विद्यार्थी संगठनका अध्यक्ष महेश बहादुर सिंह, महिला संगठनकी अध्यक्ष कुन्ती शाही, उपाध्यक्ष सरस्वती लामा, युवा उपाध्यक्ष कैलाश कटुवाललगायतलाई प्रहरीले नियन्त्रणमा लिएको छ ।",https://www.khabarhub.com/2020/11/163267/,"काठमाडौं,नेपाली,भूमि,लिपुलेक,हुँदै,भारत,सडक,निर्माण,गरीसी,अतिक्रमण,राप्रपा,भातृ,संगठन,युवा,विद्यार्थी,महिला,संगठन,राजधानी,विरोध,प्रदर्शन,भारतीय,राजदूतावास,क्रम,संगठन,प्रदर्शन,प्रहरी,हस्तक्षप,राष्ट्रिय,प्रजातान्त्रिक,युवा,संगठन,अध्यक्ष,प्रकाश,रिमाल,विद्यार्थी,संगठन,अध्यक्ष,महेश,बहादुर,सिंह,महिला,संगठन,अध्यक्ष,कुन्ती,शाही,उपाध्यक्ष,सरस्वती,लामा,युवा,उपाध्यक्ष,कैलाश,कटुवाललगायत,प्रहरी,नियन्त्रण,लिए"
11/05/2020,म्याग्दीमा बुबाको हत्या अभियोगमा छोरा पक्राउ, म्याग्दी – म्याग्दीको बेनी नगरपालिका–१ रत्नेचौरको सिममा ढुङ्गा प्रहार गरी आफ्नै बुबाको हत्या गरेको अभियोगमा आइतबार साँझ प्रहरीले एक जनालाई पक्राउ गरेको छ । शनिबार राति १० बजे बेनी नगरपालिका–१ रत्नेचौरका २९ वर्षीय कुमार थापा मगरले आफ्नै बुबा ५१ वर्षीय मीनबहादुरलाई टाउकामा ढुङ्गा प्रहार गरेर सख्त घाइते बनाएका थिए । बुबा मीनबहादुरको उपचारका क्रममा पोखरामा आइतबार साँझ मृत्यु भएको जिल्ला प्रहरी कार्यालय म्याग्दीका प्रहरी नायब उपरीक्षक किरणजङ्ग कुँवरले जानकारी दिए । अभियुक्त कुमारलाई पक्राउ गरी जिल्ला प्रहरी कार्यालयमा ल्याइएको उनले बताए । अभियुक्त कुमारले प्रहार गरेको ढुङ्गाले अचेत भएका मीनबहादुरलाई बेनी अस्पतालमा उपचार सम्भव नभएपछि पोखराको मणिपाल अस्पतालमा सिफारिस गरिएको थियो । कुँवरका अनुसार छोराले ढुङ्गा प्रहार गरेको प्रत्यक्षदर्शी कुमारकी आमाको बयान दिएकी र छोरा कुँवरले पनि स्वीकार गरेका छन् ।,https://www.khabarhub.com/2020/11/163204/,"बेनी,नगरपालि,रत्नेचौर,सिम,ढुङ्गा,प्रहार,बुबा,हत्या,अभियोग,आइतबार,साँझ,प्रहरी,पक्राउ,शनिबार,राति,बजे,बेनी,नगरपालि,रत्नेचौर,वर्षीय,कुमार,थापा,मगर,बुबा,वर्षीय,मीनबहादुर,टाउका,ढुङ्गा,प्रहार,सख्त,घाइते,बनाए,बुबा,मीनबहादुर,उपचार,क्रम,पोखरा,आइतबार,साँझ,मृत्यु,प्रहरी,कार्यालय,प्रहरी,नायब,उपरीक्षक,किरणजङ्ग,कुँवर,जानकारी,अभियुक्त,कुमार,पक्राउ,प्रहरी,कार्यालय,ल्याइए,उन,अभियुक्त,कुमार,प्रहार,ढुङ्गा,अचेत,मीनबहादुर,बेनी,अस्पताल,उपचार,नभए,पोखरा,मणिपाल,अस्पताल,सिफारिस,गरिए,कुँवर,छोरा,ढुङ्गा,प्रहार,प्रत्यक्षदर्शी,कुमार,आमा,बयान,छोरा,कुँवर,स्वीकार"
