DATE,TITLE,MAIN_NEWS,SOURCE_URL,tokens
27/05/2020,भारतबाट आएकाहरु वडाको क्वारेन्टाइनमा बसेको भन्दै विरोध," जनकपुर- भारतको विभिन्‍न ठाउँबाट आएर आफ्नो वडाको क्वारेन्टाइनमा बसेको भन्दै धनुषामा स्थानीयहरुले विरोध जनाएका छन् । भारतबाट आएर आफ्नो वडाको क्वरेन्टाइनमा बसेको भन्दै कमला नगरपालिका वडा नं. ९ का स्थानीयले विरोध जनाएका हुन् । उनीहषरुले क्वारेन्टाइनमा ढुंगामुढा प्रहार समेत गरेका छन् । स्थानीयहरुले आफ्नो वडामा रहेको क्वारेन्टाइनमा अन्य ठाउँका व्यक्तिलाई बस्न दिएकोमा विरोध जनाएका हुन् । उनीहरुले अन्य स्थानका मानिसहरुले क्वारेन्टाइनमा बस्न नदिने भन्दै लठी, भाटा सहित विरोधमा उत्रिएका थिए ।",https://www.khabarhub.com/2020/26/169143/,"जनकपुर,भारत,विभिन्,ठाउँ,आएर,वडा,क्वारेन्टाइन,बसे,स्थानीय,विरोध,जनाए,भारत,आएर,वडा,क्वरेन्टाइन,बसे,कमला,नगरपालि,वडा,नं,स्थानीय,विरोध,जनाए,उनीहषरु,क्वारेन्टाइन,ढुंगामुढा,प्रहार,स्थानीय,वडा,रहे,क्वारेन्टाइन,ठाउँ,व्यक्ति,बस्न,विरोध,जनाए,स्थान,मानिस,क्वारेन्टाइन,बस्न,नदिने,लठी,भाटा,विरोध,उत्रिए"
24/05/2020,चिर्पट प्रहारबाट एकको मृत्यु," सप्तरी- सप्तरीको डाकनेश्वरी नगरपालिका–९ सखुवामा काठको चिर्पट प्रहारबाट एक जनाको मृत्यु भएको छ । घाइते डाकनेश्वरी नगरपालिका–९ सखुवाका ५५ वर्षीय सुखदेव मण्डलको उपचारको क्रममा गए राति न्यूरो अस्पताल विराटनगरमा मृत्यु भएको मृतकका परिवारले जानकारी दिएको छ । शनिबार साँझ उपचारका लागि राजविराजस्थित गजेन्द्रनारायण सिंह अस्पताल भर्ना भएका मण्डलको उपचार हुन नसकेपछि बिराटनगर लगिएको थियो । डाकनेश्वरी नगरपालिका–९ का वडाध्यक्ष कर्णदेव चौधरीले बाटोमा घर बनाएको विषयमा मेहता परिवार र मण्डल परिवारबीच भएको विवाद र झडपमा घाइते सुखदेव मण्डलको मृत्यु भएको बताए । पीडित परिवारले मुकेश महतो, फुरकुन भनिने देवेन्द्र महतो, शिवनारायण महतो, उमेश महतोलगायतले कुटपिट गरेको आरोप लगाएका छन् । मुकेशले नयाँ निर्माण गरिरहेको घर बाटोमा परेको भन्दै रोक्न गएपछि शुरु भएको विवादले उग्ररुप लिएको प्रत्यक्षदर्शीले बताए । शव परीक्षणका लागि राजविराजस्थित गजेन्द्रनारायण सिंह अस्पतालमा ल्याइएको छ । कुटपिटबाट सुखदेव मण्डलको मृत्यु भएको लिखित उजुरी नआए पनि मौखिक जानकारी आएपछि आरोपितहरुको खोजीकार्य शुरु गरिएको जिल्ला प्रहरी कार्यालय सप्तरीका प्रहरी नायाब उपरीक्षक तिलक भारतीले बताए । यसअघि वैशाख २३ गते भएको कुटपिटमा घाइते भएका सप्तरीको महादेवा गाउँपालिका–१ बल्थीका ८० वर्षीय सुविलाल यादवको बिहीबार मृत्यु भएको थियो । उपचारपश्चात वैशाख २७ गते डिस्चार्ज भई घरमा बसेका वृद्धको मृत्यु भएको भन्दै एक जनाविरुद्ध उजुरी परेको र हालसम्म पक्राउ नपरेको प्रनाउ भारतीले बताए ।",https://www.khabarhub.com/2020/24/168283/,"डाकनेश्वरी,नगरपालि,सखुवा,काठ,चिर्पट,प्रहार,मृत्यु,घाइते,डाकनेश्वरी,नगरपालि,सखुवा,वर्षीय,सुखदेव,मण्डल,उपचार,क्रम,राति,न्यूरो,अस्पताल,विराटनगर,मृत्यु,मृतक,परिवार,जानकारी,शनिबार,साँझ,उपचार,राजविराज,गजेन्द्रनारायण,सिंह,अस्पताल,भर्ना,मण्डल,उपचार,नसके,बिराटनगर,लगिए,डाकनेश्वरी,नगरपालि,वडाध्यक्ष,कर्णदेव,चौधरी,बाटो,बनाए,विषय,मेहता,परिवार,मण्डल,परिवार,विवाद,झडप,घाइते,सुखदेव,मण्डल,मृत्यु,पीडित,परिवार,मुकेश,महतो,फुरकुन,भनिने,देवेन्द्र,महतो,शिवनारायण,महतो,उमेश,महतो,कुटपिट,आरोप,लगाए,मुकेश,निर्माण,बाटो,परे,रोक्न,शुरु,विवाद,उग्ररुप,लिए,प्रत्यक्षदर्शी,शव,परीक्षण,राजविराज,गजेन्द्रनारायण,सिंह,अस्पताल,ल्याइए,कुटपिट,सुखदेव,मण्डल,मृत्यु,लिखित,उजुरी,नआए,मौखिक,जानकारी,आरोपित,खोजीकार्य,शुरु,गरिए,प्रहरी,कार्यालय,प्रहरी,नायाब,उपरीक्षक,तिलक,भारती,वैशाख,गते,कुटपिट,घाइते,महादेवा,गाउँपालि,बल्थी,वर्षीय,सुविलाल,यादव,बिहीबार,मृत्यु,उपचार,वैशाख,गते,डिस्चार्ज,भई,बसे,वृद्ध,मृत्यु,उजुरी,परे,हाल,पक्राउ,नपरे,प्रनाउ,भारती"
24/05/2020,चिर्पट प्रहारबाट एकको मृत्यु," सप्तरी- सप्तरीको डाकनेश्वरी नगरपालिका–९ सखुवामा काठको चिर्पट प्रहारबाट एक जनाको मृत्यु भएको छ । घाइते डाकनेश्वरी नगरपालिका–९ सखुवाका ५५ वर्षीय सुखदेव मण्डलको उपचारको क्रममा गए राति न्यूरो अस्पताल विराटनगरमा मृत्यु भएको मृतकका परिवारले जानकारी दिएको छ । शनिबार साँझ उपचारका लागि राजविराजस्थित गजेन्द्रनारायण सिंह अस्पताल भर्ना भएका मण्डलको उपचार हुन नसकेपछि बिराटनगर लगिएको थियो । डाकनेश्वरी नगरपालिका–९ का वडाध्यक्ष कर्णदेव चौधरीले बाटोमा घर बनाएको विषयमा मेहता परिवार र मण्डल परिवारबीच भएको विवाद र झडपमा घाइते सुखदेव मण्डलको मृत्यु भएको बताए । पीडित परिवारले मुकेश महतो, फुरकुन भनिने देवेन्द्र महतो, शिवनारायण महतो, उमेश महतोलगायतले कुटपिट गरेको आरोप लगाएका छन् । मुकेशले नयाँ निर्माण गरिरहेको घर बाटोमा परेको भन्दै रोक्न गएपछि शुरु भएको विवादले उग्ररुप लिएको प्रत्यक्षदर्शीले बताए । शव परीक्षणका लागि राजविराजस्थित गजेन्द्रनारायण सिंह अस्पतालमा ल्याइएको छ । कुटपिटबाट सुखदेव मण्डलको मृत्यु भएको लिखित उजुरी नआए पनि मौखिक जानकारी आएपछि आरोपितहरुको खोजीकार्य शुरु गरिएको जिल्ला प्रहरी कार्यालय सप्तरीका प्रहरी नायाब उपरीक्षक तिलक भारतीले बताए । यसअघि वैशाख २३ गते भएको कुटपिटमा घाइते भएका सप्तरीको महादेवा गाउँपालिका–१ बल्थीका ८० वर्षीय सुविलाल यादवको बिहीबार मृत्यु भएको थियो । उपचारपश्चात वैशाख २७ गते डिस्चार्ज भई घरमा बसेका वृद्धको मृत्यु भएको भन्दै एक जनाविरुद्ध उजुरी परेको र हालसम्म पक्राउ नपरेको प्रनाउ भारतीले बताए ।",https://www.khabarhub.com/2020/24/168283/,"डाकनेश्वरी,नगरपालि,सखुवा,काठ,चिर्पट,प्रहार,मृत्यु,घाइते,डाकनेश्वरी,नगरपालि,सखुवा,वर्षीय,सुखदेव,मण्डल,उपचार,क्रम,राति,न्यूरो,अस्पताल,विराटनगर,मृत्यु,मृतक,परिवार,जानकारी,शनिबार,साँझ,उपचार,राजविराज,गजेन्द्रनारायण,सिंह,अस्पताल,भर्ना,मण्डल,उपचार,नसके,बिराटनगर,लगिए,डाकनेश्वरी,नगरपालि,वडाध्यक्ष,कर्णदेव,चौधरी,बाटो,बनाए,विषय,मेहता,परिवार,मण्डल,परिवार,विवाद,झडप,घाइते,सुखदेव,मण्डल,मृत्यु,पीडित,परिवार,मुकेश,महतो,फुरकुन,भनिने,देवेन्द्र,महतो,शिवनारायण,महतो,उमेश,महतो,कुटपिट,आरोप,लगाए,मुकेश,निर्माण,बाटो,परे,रोक्न,शुरु,विवाद,उग्ररुप,लिए,प्रत्यक्षदर्शी,शव,परीक्षण,राजविराज,गजेन्द्रनारायण,सिंह,अस्पताल,ल्याइए,कुटपिट,सुखदेव,मण्डल,मृत्यु,लिखित,उजुरी,नआए,मौखिक,जानकारी,आरोपित,खोजीकार्य,शुरु,गरिए,प्रहरी,कार्यालय,प्रहरी,नायाब,उपरीक्षक,तिलक,भारती,वैशाख,गते,कुटपिट,घाइते,महादेवा,गाउँपालि,बल्थी,वर्षीय,सुविलाल,यादव,बिहीबार,मृत्यु,उपचार,वैशाख,गते,डिस्चार्ज,भई,बसे,वृद्ध,मृत्यु,उजुरी,परे,हाल,पक्राउ,नपरे,प्रनाउ,भारती"
23/05/2020,आर्थिक अनियमितता गरेको भन्दै रौतहटमा मन्त्री त्रिपाठीको पुत्ला दहन," गौर- रौतहटका स्थानीय युवाहरुले संघीय मामिला तथा सामान्य प्रशासन मन्त्री हृदयेश त्रिपाठीको पुत्ला जलाएका छन् । मन्त्री त्रिपाठीले रौतहट क्षेत्र नम्बर २ को संसदीय कोषको बजेट दुरुपयोग गर्न खोजेको आरोप लगाउँदै स्थानीयले नाराबाजीसहित पुत्ला दहन गरेका हुन् । विश्व कोरोना संक्रमणको उच्च जोखिमयुक्त अवस्थाबाट गुज्रिरहेको समयमा संघीय मन्त्रालयको अग्रसरतामा रौतहट निर्वाचन क्षेत्र नं. २ का सांसद अफताब आलमको अनुपस्थितिमै नियम कानुन विपरीत संसदीय पूर्वाधार विकास कार्यक्रम कार्यान्वयन भएको भन्दै उनीहरुले विरोध जनाएका छन् । आर्थिक चलखेल गरेर मन्त्री त्रिपाठी, जेलभित्रबाट सांसद आलम र नेकपाका समानुपातिक सांसद कल्याणी खड्काले मिलेर बजेट दुरुपयोग गरेका कारण पुतला दहन गरेको स्थानीय इस्तफाल आलमले बताए । आक्रोशित युवाहरुले मन्त्रीकै संलग्नतामा खर्च भईरहेको अनधिकृत बजेट खर्च नरोकिए लकडाउनको प्रवाह नगरी आन्दोलन गर्ने चेतावनी समेत दिएका छन् ।",https://www.khabarhub.com/2020/23/167959/,"गौर,स्थानीय,युवा,संघीय,मामिला,सामान्य,प्रशासन,मन्त्री,हृदयेश,त्रिपाठी,पुत्ला,जलाए,मन्त्री,त्रिपाठी,क्षेत्र,नम्बर,संसदीय,कोष,बजेट,दुरुपयोग,खोजे,आरोप,लगाउँदै,स्थानीय,नाराबाजी,पुत्ला,दहन,विश्व,कोरोना,संक्रमण,उच्च,जोखिमयुक्त,गुज्रि,संघीय,मन्त्रालय,अग्रसरता,निर्वाचन,क्षेत्र,नं,सांसद,अफताब,आलम,अनुपस्थिति,नियम,कानुन,विपरीत,संसदीय,पूर्वाधार,विकास,कार्यक्रम,कार्यान्वयन,विरोध,जनाए,आर्थिक,चलखेल,मन्त्री,त्रिपाठी,जेलभित्र,सांसद,आलम,नेकपा,समानुपातिक,सांसद,कल्याणी,खड्का,मिलेर,बजेट,दुरुपयोग,पुतला,दहन,स्थानीय,इस्तफाल,आलम,आक्रोशित,युवा,मन्त्री,संलग्नता,खर्च,भई,अनधिकृत,बजेट,खर्च,नरोकिए,लकडाउन,प्रवाह,नगरी,आन्दोलन,चेतावनी"
23/05/2020,"महिला मृत फेला, हत्याको आशंकामा एक जना पक्राउ"," खोटाङ- खोटेहाङ गाउँपालिका–५ चिप्रिङ पोखरेटोलकी ६१ वर्षीया एकल महिला रत्नकुमारी राई आफ्नै घरमा मृत फेला परेकी छन् । दुई छोरीको विवाह भइसकेको र श्रीमानको पनि मृत्यु भइसकेको अवस्थामा एक्लै घरमा बस्दै आएकी रत्नकुमारीको शव आज बिहान फेला परेको थियो । एकल महिलाको हत्या गरेको आशङ्कामा सोही ठाउँका ३१ वर्षीय मुगाधन भनिने मुकेश राईलाई पक्राउ गरिएको जिल्ला प्रहरी कार्यालयका प्रहरी नायब उपरीक्षक नारायण चिमोरियाले बताए । “एकल महिलाको गए राति १००० बजे घाँटी थिचेर हत्या गरिएको प्रारम्भिक अनुसन्धानबाट खुलेको छ”, उनले भने, “पक्राउ परेका मुकेशले प्रहरी सामु ‘मान्छे मारेर आएको’ भनेका छन् ।” महिलाको हत्यापछि आज बिहान सिम्पानीतर्फ जाँदै गरेका मुकेशलाई प्रहरीले बाटैबाट नियन्त्रणमा लिएको गाउँपालिकाका अध्यक्ष प्रदीप राईले बताए । स्थानीय बासिन्दाले प्रहरीलाई खबर गरेपछि वडासदस्य अर्जुन राईसँगै छिमेकीलाई हेर्न पठाउँदा महिला मृत फेला परेकी थिइन् । महिला हत्याको कारण खुल्न बाँकी रहेको र अनुसन्धान भइरहेको जिल्ला प्रहरी कार्यालयका प्रवक्ता प्रहरी निरीक्षक आमोदकुमार खेरवारले जानकारी दिए ।",https://www.khabarhub.com/2020/22/167679/,"खोटेहाङ,गाउँपालि,चिप्रिङ,पोखरेटोल,वर्षीया,एकल,महिला,रत्नकुमारी,राई,मृत,फेला,परे,छोरी,विवाह,भइ,श्रीमान,मृत्यु,भइ,एक्लै,बस्दै,रत्नकुमारी,शव,बिहान,फेला,परे,एकल,महिला,हत्या,आशङ्का,ठाउँ,वर्षीय,मुगाधन,भनिने,मुकेश,राई,पक्राउ,गरिए,प्रहरी,कार्यालय,प्रहरी,नायब,उपरीक्षक,नारायण,चिमोरिया,“एकल,महिला,राति,बजे,घाँटी,थिचेर,हत्या,गरिए,प्रारम्भिक,अनुसन्धान,खुले,छ”,उन,“पक्राउ,परे,मुकेश,प्रहरी,मान्छे,मारेर,”,महिला,हत्या,बिहान,सिम्पानी,जाँदै,मुकेश,प्रहरी,नियन्त्रण,लिए,गाउँपालिका,अध्यक्ष,प्रदीप,राई,स्थानीय,बासिन्दा,प्रहरी,खबर,वडासदस्य,अर्जुन,राई,छिमेकी,हेर्न,पठाउँदा,महिला,मृत,फेला,परे,थिइन्,महिला,हत्या,खुल्न,बाँकी,रहे,अनुसन्धान,भइ,प्रहरी,कार्यालय,प्रवक्ता,प्रहरी,निरीक्षक,आमोदकुमार,खेरवार,जानकारी"
