DATE,TITLE,MAIN_NEWS,SOURCE_URL,tokens
23/07/2020,"सीमा सुरक्षामा खटिएका सशस्त्र प्रहरीको हत्या, विवाहमा भएको विवादपछि चोर भन्दै लखेटेको दाबी","काठमाडौँ  सिराहाको सिराहा नगरपालिका-१७ स्थित नेपाल-भारत सीमा सुरक्षामा खटिएका सशस्त्र प्रहरी बल-एपिएफका जवान मनोहर कुमार यादबको हत्या भएको प्रहरीले दाबी गरेको छ। घटनामा संलग्न भएको आरोपमा प्रहरीले तीनजनालाई पक्राउ गरेको छ। सिराहा नगरपालिका-३ स्थित एक स्थानीय युवतीको विवाहमा भएको विवादपछि जवान यादबलाई चोर-चोर भन्दै तीन किलोमिटरसम्म खेदाएर नहरमा डुबाएर मारेको आरोप प्रहरीको छ। सोही ठाउँकी एक युवतीसँग यादबको प्रेम सम्बन्ध रहेको प्रदेश-२ प्रहरी प्रमुख डीआईजी धिरजप्रताप सिंहले जानकारी दिए।। ‘प्रेमिकाको आफन्तको विवाहमा यादब ती युवतीसहित पुगेका रहेछन्। जवानको प्रेम सम्बन्ध स्थानीय युवालाई मन परेको रहेनछ। विवाहमा मादक पदार्थ सेवन गरेका युवाहरुले विवादपछि जवान यादबलाई लखेटेको देखिन्छ’, डीआईजी सिंहले भने। महोत्तरीको सोनमा गाउँपालिकाका यादबको शव गत असार १६ गते सिराहा नगरपालिका-१४ खिरौनास्थित नहरमा भेटिएको थियो। घटनामा संलग्न भएको आरोपमा प्रहरीले सिराहा नगरपालिका-३ का २५ वर्षीय जयकेशकुमार यादब, २० वर्षीय दिपेशकुमार यादब र २२ वर्षीय मुकेशकुमार यादबलाई पक्राउ गरेको छ। ",https://deshsanchar.com/2020/07/23/387511/,"नगरपालि,भारत,सीमा,सुरक्षा,खटिए,सशस्त्र,प्रहरी,बल,एपिएफका,जवान,मनोहर,कुमार,यादब,हत्या,प्रहरी,दाबी,घटना,संलग्न,आरोप,प्रहरी,तीनजना,पक्राउ,नगरपालि,स्थानीय,युवती,विवाह,विवाद,जवान,यादब,चोर,चोर,किलोमिटर,खेदाएर,नहर,डुबाएर,मारे,आरोप,प्रहरी,ठाउँ,युवती,यादब,प्रेम,सम्बन्ध,रहे,प्रहरी,प्रमुख,डीआईजी,धिरजप्रताप,सिंह,जानकारी,प्रेमिकाको,आफन्त,विवाह,यादब,युवती,पुगे,रहेछन्,जवान,प्रेम,सम्बन्ध,स्थानीय,युवा,मन,परे,रहेनछ,विवाह,मादक,पदार्थ,सेवन,युवा,विवाद,जवान,यादब,लखेटे,डीआईजी,सिंह,सोन,गाउँपालिका,यादब,शव,गत,असार,गते,नगरपालि,खिरौना,नहर,भेटिए,घटना,संलग्न,आरोप,प्रहरी,नगरपालि,वर्षीय,जयकेशकुमार,यादब,वर्षीय,दिपेशकुमार,यादब,वर्षीय,मुकेशकुमार,यादब,पक्राउ"
22/07/2020,"बोली स्पष्ट नभएकी बालिका बलात्कृत, आरोपी पक्राउ","विराटनगर  मोरङको लेटांग नगरपालिकामा एक १६ वर्षीया बालिका बलाकृत भएकी छिन् । जिल्ला प्रहरी कार्यालय मोरङले स्पष्ट रुपमा बोल्न नसक्ने अशक्त बालिकाको गत असार २८ गते राती बलात्कार भएको जनाएको छ । मोरङका प्रहरी प्रमुख प्रहरी उपरीक्षक सन्तोष खड्काले घटनामा संलग्न आरोपी १९ वर्षीय भीम राईलाई पक्राउ गरिएको जनाएका छन् । लेटांग नगरपालिका ८ का स्थानीय राईलाई पीडित परिवारका सदस्य किटानी जाहेरी दिएपछि पक्राउ गरिएको प्रहरी उपरीक्षक खड्काले बताए । पीडितको जाहेरीसँगै अनुसन्धान तीव्र बनाएको प्रहरीले मंगलबार अपरान्ह पक्राउ गरेको उनको भनाइ छ । असार २८ गते साथीको घरमा बस्न गएकी पीडित बालिकामाथि बलात्कार भएको प्रहरीको प्रारम्भिक अनुसन्धानले जनाएको छ । पक्राउ परेका आरोपी राई पीडित बालिकाको साथीको नाता पर्ने आफन्त भएको बताइएको छ । पक्राउ परेको आरोपीमाथि प्रहरीले जबरजस्ती करणी मुद्धा अघि बढाउने भएको छ । """,https://deshsanchar.com/2020/07/22/387041/,"विराटनगर,लेटांग,वर्षीया,बालिका,बलाकृत,छिन्,प्रहरी,कार्यालय,रुप,बोल्न,नसक्ने,अशक्त,बालिका,गत,असार,गते,राती,बलात्कार,जनाए,प्रहरी,प्रमुख,प्रहरी,उपरीक्षक,सन्तोष,खड्का,घटना,संलग्न,आरोपी,वर्षीय,भीम,राई,पक्राउ,गरिए,जनाए,लेटांग,नगरपालि,स्थानीय,राई,पीडित,परिवार,सदस्य,किटानी,जाहेरी,पक्राउ,गरिए,प्रहरी,उपरीक्षक,खड्का,पीडित,जाहेरी,अनुसन्धान,तीव्र,बनाए,प्रहरी,मंगलबार,अपरान्ह,पक्राउ,उन,भनाइ,असार,गते,साथी,बस्न,पीडित,बालिका,बलात्कार,प्रहरी,प्रारम्भिक,अनुसन्धान,जनाए,पक्राउ,परे,आरोपी,राई,पीडित,बालिका,साथी,नाता,आफन्त,बताइए,पक्राउ,परे,आरोपी,प्रहरी,जबरजस्ती,करणी,मुद्धा,बढाउने"
18/07/2020,इनफ इज इनफ अभियानले फेरि थाल्यो सत्याग्रह,"काठमाडौँ  सरकारले आफूहरुसँग भएको सहमति कार्यान्वयका लागि कुनै पहल नगरेको भन्दै ‘इनफ इज इनफ’ अभियानले पुनः सत्याग्रह थालेको छ। सहमतिको १२ दिन बित्दा पनि स्वास्थ्य मन्त्रालयले सो कार्यान्वयनका लागि पहल नगरेकाले बाध्य भएर पुनः सत्याग्रह थालिएको अभियानले जनाएको छ। स्वास्थ्य मन्त्रालय र इनफ इज इनफका सत्याग्रहीबिच १२ दिनअघि हप्तादिन भित्र सहमति कार्यान्वयन गर्ने गरी १२ बुँदै सम्झौता भएको थियो। तर दोस्रो चरणको फलोअप बैठकपछि कार्यान्वयनका लागि पाँच दिनको समय थप गरिएको थियो। यो अविधिमा पनि केही पहल नभएको भन्दै अभियानले शनिबार दिउँसोदेखि काठमाडौँको बसन्तपुरमा पुनः सत्याग्रह हो। इनफ इज इनफ अभियानले बसन्तपुरमा आम सत्याग्रहको घोषणा गरेको हो । अहिले अभियन्ता इशान अधिकारी (इ) सत्याग्रहमा छन्। अभियानले उनलाई साथ दिन चाहनेलाई सत्याग्रहमा बस्नका लागि आह्वान समेत गरेको छ। सो अभियानले कोरोना भाइरस महामारी नियन्त्रणका लागि सरकारी प्रयास प्रभावकारी बनाउनु पर्ने, नागरिकको जीवन रक्षा गर्नु पर्ने, कोरोना भाइरसको परीक्षण शतप्रतिशत पीसीआर विधिबाट हुनु पर्नेसहितका माग राखेर आन्दोलन गरेका थिए। स्वास्थ्य मन्त्रालय र १२ दिनसम्म सत्याग्रहमा बसेका अभियन्ताबिच ती माग पूरा गर्नेबारे १२ बुँदे सहमति भएको थियो। ",https://deshsanchar.com/2020/07/18/385165/,"सरकार,सहमति,कार्यान्वय,पहल,नगरे,इनफ,इज,इनफ,अभियान,पुनः,सत्याग्रह,थाले,सहमति,बित्दा,स्वास्थ्य,मन्त्रालय,कार्यान्वयन,पहल,नगरेका,बाध्य,पुनः,सत्याग्रह,थालिए,अभियान,जनाए,स्वास्थ्य,मन्त्रालय,इनफ,इज,इनफ,सत्याग्रही,हप्तादिन,सहमति,कार्यान्वयन,बुँदै,सम्झौता,चरण,फलोअप,बैठक,कार्यान्वयन,गरिए,अविधि,पहल,नभए,अभियान,शनिबार,दिउँसो,बसन्तपुर,पुनः,सत्याग्रह,इनफ,इज,इनफ,अभियान,बसन्तपुर,आम,सत्याग्रह,घोषणा,अभियन्ता,इशान,अधिकारी,इ,सत्याग्रह,अभियान,उन,चाहने,सत्याग्रह,बस्न,आह्वान,अभियान,कोरोना,भाइरस,महामारी,नियन्त्रण,सरकारी,प्रयास,प्रभावकारी,बनाउनु,नागरिक,जीवन,रक्षा,कोरोना,भाइरस,परीक्षण,शतप्रतिशत,पीसीआर,विधि,माग,राखेर,आन्दोलन,स्वास्थ्य,मन्त्रालय,सत्याग्रह,बसे,अभियन्ता,माग,पूरा,बुँदे,सहमति"
