DATE,TITLE,MAIN_NEWS,SOURCE_URL,tokens
15/06/2020,प्रजातान्त्रिक युवा संगठनद्वारा काठमाडौंको बौद्धमा प्रदर्शन,"काठमाडौं । राष्ट्रिय प्रजातान्त्रिक युवा संगठनले मंगलबार काठमाडौंको बौद्धमा सरकारविरुद्ध प्रदर्शन गरेका छन् । संगठनले कोरोना भाइरस संक्रमण नियन्त्रण भन्दापनि भ्रष्टाचारमा लिप्त भएको भन्दै सरकारको विरोध गरेको छ । विरोध कार्यक्रममा युवा संगठनका अध्यक्ष कैलाश कटुवाल, सचिव हिक्मतजंग कार्कीलगायतले सरकारले जनचाहना अनुसारको काम गर्न नसकेको भन्दै सरकारको आलोचना गरेका थिए । ",https://imagekhabar.com/news/35106/-,"काठमाडौं,राष्ट्रिय,प्रजातान्त्रिक,युवा,संगठन,मंगलबार,काठमाडौं,बौद्ध,सरकार,प्रदर्शन,संगठन,कोरोना,भाइरस,संक्रमण,नियन्त्रण,भ्रष्टाचार,लिप्त,सरकार,विरोध,विरोध,कार्यक्रम,युवा,संगठन,अध्यक्ष,कैलाश,कटुवाल,सचिव,हिक्मतजंग,कार्की,सरकार,जनचाहना,नसके,सरकार,आलोचना"
14/06/2020,पिसीआर परीक्षणको माग गर्दै सुर्खेतमा प्रदर्शन,"सुर्खेत, जेठ ३२ । कोरोना परिक्षणमा पीसीआर परीक्षणको दायरा बढाउन सुर्खेतका युवाहरुले माग गरेका छन । आरडिटी परीक्षणको नतिजा विश्वनीय नभएकाले पीसीआर परीक्षणको दायरा बढाउनु पर्ने भन्दै उनिहरुले सुर्खेतको वीरेन्द्रनगरमा जुलुस निकालेका हुन् । युवाहरुले लकडाउनको समयमा भारतबाट आएर क्वारेन्टिनमा बसेका नेपालीहरुको व्यवस्थापन हुन नसकेको र मानिसको मृत्यु पछि मात्र परीक्षण हुने गरेको भन्दै उनीहरुले सरकारको बिरोध गरेका छन् । ",https://imagekhabar.com/news/35002/,"जेठ,कोरोना,परिक्षण,पीसीआर,परीक्षण,दायरा,बढाउन,युवा,माग,आरडिटी,परीक्षण,नतिजा,विश्वनीय,नभएका,पीसीआर,परीक्षण,दायरा,बढाउनु,वीरेन्द्रनगर,जुलुस,निकाले,युवा,लकडाउन,भारत,आएर,क्वारेन्टिन,बसे,नेपाली,व्यवस्थापन,नसके,मानिस,मृत्यु,परीक्षण,सरकार,बिरोध"
09/06/2020,कपनमा अज्ञात व्यक्तिबाट बसमा आगजनी,"काठमाडौं, जेठ २७ । काठमाडौंको बुढानीलकण्ठ नगरपालिका१० कपन नजिक पार्किङ गरी राखेको बा २ ख ६२२६ नम्बरको बसमा मंगलबार अपरिचित व्यक्तिले आगजनी गरेका छन् । आगलागीबाट बसमा करिब रु. एक लाख ५० हजार मूल्य बराबरको धनमाल जलेर नष्ट भएको छ । अपरिचित व्यक्तिले उक्त बसमा आगजनी गरेको भन्ने खबर प्राप्त हुनासाथ महानगरीय प्रहरी प्रभाग कपनबाट खटिएको प्रहरीले स्थानीयको सहयोगमा आगो नियन्त्रणमा लिएको छ । फरार व्यक्तिहरुको खोजी गर्नुका साथै यस सम्बन्धमा प्रहरीले थप अनुसन्धान गरिरहेको जनाएको छ । रासस ",https://imagekhabar.com/news/34707/-,"काठमाडौं,जेठ,काठमाडौं,बुढानीलकण्ठ,कपन,नजिक,पार्किङ,बा,ख,नम्बर,बस,मंगलबार,अपरिचित,व्यक्ति,आगजनी,आगलागी,बस,करिब,रु,मूल्य,बराबर,धनमाल,जलेर,नष्ट,अपरिचित,व्यक्ति,बस,आगजनी,खबर,प्राप्त,हुना,महानगरीय,प्रहरी,प्रभाग,कपन,खटिए,प्रहरी,स्थानीय,सहयोग,आगो,नियन्त्रण,लिए,फरार,व्यक्ति,खोजी,सम्बन्ध,प्रहरी,अनुसन्धान,जनाए,रासस"
09/06/2020,बर्दियामा आक्रोशित समूहले गर्यो सप्लायर्समा आगजनी,बर्दिया । आफन्तले ज्यान गुमाएपछी उचित क्षतिपुर्ति नपाएको भन्दै आक्रोशित भिडले बर्दियाको राजापुर ६ टपरामा रहेको न्यू वर्षा सप्लायर्समा आगजनी गरेको छ । दुर्घटनामा ज्यान गुमाएका आफन्तहरुले आफुहरुको मागको उचित सम्बोधन नभएको भन्दै आगजनी गरेका हुन् । आगलागीबाट ८६ लाख ६० हजार ५ सय बराबरको क्षति भएको इलाका प्रहरी कार्यालय राजापुरका डिएसपी मिन बहादुर घलेले जानकारी दिए । गत वैशाख ३० गते भे १ च ३४३१ नम्बरको डेलीभरी भ्यान र से ५ च ४३३२ नम्बरको मोटरसाइकल एक आपसमा ठोक्किँदा मोटरसाइकल चालक राजापुर नगरपालिका वडा नम्बर ६ महादेउलीका ३८ वर्षका सोमनाथ थारुको ज्यान गएको थियो । भ्यान चालक हिमाल गौतमलाई अहिले जिल्ला अदालतले १ लाख २० हजार धरौटीमा तारेखमा छोडेको छ । ,https://imagekhabar.com/news/34665/-,"आफन्त,ज्यान,गुमाए,उचित,क्षतिपुर्ति,नपाए,आक्रोशित,भिड,राजापुर,टपरा,रहे,न्यू,वर्षा,सप्लायर्स,आगजनी,दुर्घटना,ज्यान,गुमाए,आफन्त,आफु,माग,उचित,सम्बोधन,नभए,आगजनी,आगलागी,बराबर,क्षति,इलाका,प्रहरी,कार्यालय,राजापुर,डिएसपी,मिन,बहादुर,घले,जानकारी,गत,वैशाख,गते,भे,च,नम्बर,डेली,भ्यान,से,च,नम्बर,मोटरसाइकल,आपस,ठोक्किँदा,मोटरसाइकल,चालक,राजापुर,नगरपालि,वडा,नम्बर,महादेउली,वर्ष,सोमनाथ,थारु,ज्यान,भ्यान,चालक,हिमाल,गौतम,अदालत,धरौटी,तारेख,छोडे"
02/06/2020,एमसीसी सम्झौता खारेजीको माग गर्दै प्रदर्शन,काठमाडौं । अमेरिकी मिलेनियम च्यालेञ्ज कर्पोरेशन एमसीसी सम्झौता खारेजीको माग गर्दै प्रदर्शन गरिएको छ । काठमाडौंको नयाँ बस पार्कमा भएको प्रदर्शनमा सहभागीहरुले राष्ट्रिय स्वाधिनताका लागि संसदबाटै एमसीसी खारेज गर्न माग गरेका थिए । नेपाली सेनालाई व्यवसायमा नभई सीमा सुरक्षार्थ खटाउनु पर्ने उनीहरुको जोड थियो । ,https://imagekhabar.com/news/34247/-,"काठमाडौं,अमेरि,मिलेनियम,च्यालेञ्ज,कर्पोरेशन,एमसीसी,सम्झौता,खारे,माग,प्रदर्शन,गरिए,काठमाडौं,बस,पार्क,प्रदर्शन,सहभागी,राष्ट्रिय,स्वाधिनता,संसद,एमसीसी,खारेज,माग,नेपाली,सेना,व्यवसाय,सीमा,सुरक्षार्थ,खटाउनु,जोड"
01/06/2020,रुकुम घटनाविरुद्ध चितवनमा प्रदर्शन,"चितवन, जेठ १९ । रुकुम पश्चिममा अन्तर जातीय विवाहको विषयमा ५ जनाको हत्या र १ जना बेपत्ता भएको घटनाविरुद्ध चितवनमा जारी प्रदर्शन रोकिएको छैन । सरकारले निष्पक्ष रुपमा घटनाको छानबिन गर्नुपर्ने र पीडितलाई न्याय दिनुपर्ने माग गर्दै प्रदर्शन गरिएको हो । स्वतन्त्र युवा अमिर सुनारको नेतृत्वमा प्रदर्शन गरिएको हो । घटना भएको दिनदेखि सो समूहले कहिले र्याली त कहिले दिप प्रज्वलन गरी घटनाको निष्पक्ष छानबीनको माग गरेका छन् । प्रदर्शनकारीहरुले गणतान्त्रिक मुलुकमा पनि नागरिक असुरक्षित हुनु परेको भन्दै नाराबाजी गरेका थिए । उनीहरुले पिडीत परिवारले न्याय पाउनु पर्ने र जातीय बिभेदको अन्त्य नभएसम्म प्रदर्शन जारी राख्ने चेतावनी दिएका छन् । भिडियो हेर्नोस्  ",https://imagekhabar.com/news/34213/-,"जेठ,रुकुम,पश्चिम,अन्तर,जातीय,विवाह,विषय,हत्या,बेपत्ता,घटना,जारी,प्रदर्शन,रोकिए,सरकार,निष्पक्ष,रुप,घटना,छानबिन,पीडित,न्याय,दिनु,माग,प्रदर्शन,गरिए,स्वतन्त्र,युवा,अमिर,सुनार,नेतृत्व,प्रदर्शन,गरिए,घटना,समूह,कहिले,र्याली,कहिले,दिप,प्रज्वलन,घटना,निष्पक्ष,छानबीन,माग,प्रदर्शनकारी,गणतान्त्रिक,मुलुक,नागरिक,असुरक्षित,परे,नाराबाजी,पिडीत,परिवार,न्याय,पाउनु,जातीय,बिभेद,अन्त्य,नभए,प्रदर्शन,जारी,राख्ने,चेतावनी,भिडियो,हेर्नोस्"
29/05/2020,रुकुम घटनाका दोषीलाई कारबाहीको माग गर्दै प्रदर्शन,"बाँके, जेठ १६ । पश्चिम रुकुमको सोतीमा भएको घटनाका दोषीलाई कारबाही गर्न माग गर्दै नेपालगञ्जमा प्रदर्शन गरिएको छ । संयुक्त दलित संघर्ष समिति, बाँकेले पश्चिम रुकुमको चौरजहारी नगरपालिकाको सोती गाउँमा नवराज विकलगायत ६ जनाको हत्याका दोषीहरुलाई तुरुन्त कारबाही माग गर्दै प्रदर्शन गरेको हो । स्थानीय प्रशासनको निषेधाज्ञा जारी रहेको बलोमा बाँकेको धम्बोझीचोक देखि शुरु भएको प्रदर्शन वीपीचोक, गणेशमानचोक हुँदै जिल्ला प्रशासन कार्यालय पुगेको थियो । यता, ताप्लेजुङका दलित अगुवा तथा दलित अधिकारकर्मीले पनि घटनाका दोषिमाथि कारबाही माग गरेका छन् । ",https://imagekhabar.com/news/34043/-,"जेठ,पश्चिम,रुकुम,सोती,घटना,दोषी,कारबाही,माग,नेपालगञ्ज,प्रदर्शन,गरिए,संयुक्त,दलित,संघर्ष,समिति,पश्चिम,रुकुम,चौरजहारी,सोती,गाउँ,नवराज,विक,हत्या,दोषी,कारबाही,माग,प्रदर्शन,स्थानीय,प्रशासन,निषेधाज्ञा,जारी,रहे,बलो,धम्बोझीचोक,शुरु,प्रदर्शन,वीपीचोक,गणेशमानचोक,हुँदै,प्रशासन,कार्यालय,पुगे,यता,दलित,अगुवा,दलित,अधिकारकर्मी,घटना,दोषि,कारबाही,माग"
29/05/2020,"कोरोना परीक्षणका क्रममा झडप, केही घाईते",काठमाडौं । काठमाडौंको बौद्धस्थित सिमलटारमा कोरोना परीक्षणका क्रममा झडप भएको छ । हुम्लाबाट काठमाडौं आइ बसेका करिब १५ सयको नाम संकलन भएपनि पांच सय मात्र आरडीटी टेष्ट किट भएपछि विवाद बढ्दै जांदा झडप भएको हो । झडप हुंदा केही व्यक्ति घाईते भएका छन् । स्थानीय जनप्रतिनिधि र प्रहरीबीच परीक्षणका लागि समन्वय नहुंदा विवाद भएको स्थानीयको भनाई छ । हुम्लाका प्रतिनिधिसभा सदस्य छक्कबहादुर लामाले आरडीटीको परीक्षण पछि उनीहरुलाई हुम्ला लाने तयारी गरेको बताइएको छ । लकडाउनका कारण हुम्लाका ५ हजार भन्दा बढी व्यक्ति काठमाडौंमा अलपत्र छन् । ,https://imagekhabar.com/news/34002/-,"काठमाडौं,काठमाडौं,बौद्ध,सिमलटार,कोरोना,परीक्षण,क्रम,झडप,काठमाडौं,आइ,बसे,करिब,नाम,संकलन,आरडीटी,टेष्ट,किट,विवाद,बढ्दै,जांदा,झडप,झडप,हुंदा,व्यक्ति,घाईते,स्थानीय,जनप्रतिनिधि,प्रहरी,परीक्षण,समन्वय,नहुंदा,विवाद,स्थानीय,भनाई,प्रतिनिधिसभा,सदस्य,छक्कबहादुर,लामा,आरडीटी,परीक्षण,लाने,तयारी,बताइए,लकडाउन,व्यक्ति,काठमाडौं,अलपत्र"
